{
  "$schema": "https://json-schema.org/draft/2020-12/schema",
  "type": "object",
  "required": [
    "status",
    "source_locks",
    "source_commits",
    "certificate",
    "theorem",
    "claim_boundary",
    "gates"
  ],
  "properties": {
    "status": {"const": "RH-374_square_clock_euler_product_capacity_floor"},
    "source_locks": {"type": "object"},
    "source_commits": {"type": "object"},
    "certificate": {"type": "object"},
    "theorem": {"type": "object"},
    "claim_boundary": {"type": "object"},
    "gates": {"type": "object"}
  },
  "additionalProperties": false
}
